{
  "updated": "2026-02-10T10:42:29.735Z",
  "total": 13,
  "reservas": [
    {
      "nombre": "Mauro Torres (4) Rio Tercero IG",
      "rango": "26/1/26 al 4/2/26",
      "contacto": 3571322126,
      "inicio": "2026-01-26T03:00:00.000Z",
      "fin": "2026-02-04T03:00:00.000Z"
    },
    {
      "nombre": "EVE (5) Rio 4 AD",
      "rango": "4/2/26 al 8/2/26",
      "contacto": 3584126016,
      "inicio": "2026-02-04T03:00:00.000Z",
      "fin": "2026-02-08T03:00:00.000Z"
    },
    {
      "nombre": "Gabriel Perez Cosquin y Maria Jose Nieto (2) ya cobrado en efete 1200 junto a 2 transfer y buzios y me dio 20 dolares de mas",
      "rango": "11/02/2026 al 15/2/26",
      "contacto": 1156383991,
      "inicio": "2026-02-11T03:00:00.000Z",
      "fin": "2026-02-15T03:00:00.000Z"
    },
    {
      "nombre": "Angeles Sierra (5) Parairnos",
      "rango": "16/2/26 al 23/2/26",
      "contacto": 1170812795,
      "inicio": "2026-02-16T03:00:00.000Z",
      "fin": "2026-02-23T03:00:00.000Z"
    },
    {
      "nombre": "Cecilia Baudino (2) redes",
      "rango": "25/2/26 al 1/3/26",
      "contacto": 3516622771,
      "inicio": "2026-02-25T03:00:00.000Z",
      "fin": "2026-03-01T03:00:00.000Z"
    },
    {
      "nombre": "Flor Magarli de parte rata (3)",
      "rango": "1/3/26 al 7/3/26",
      "contacto": 3512697542,
      "inicio": "2026-03-01T03:00:00.000Z",
      "fin": "2026-03-07T03:00:00.000Z"
    },
    {
      "nombre": "Alejandra Guerrero (2) booking",
      "rango": "9/3/26 al 11/3/26",
      "contacto": "",
      "inicio": "2026-03-09T03:00:00.000Z",
      "fin": "2026-03-11T03:00:00.000Z"
    },
    {
      "nombre": "Airbnb brasil tincho (2) desde el 11 al 14 mas la noche del 14 a R$ 168 que debe",
      "rango": "11/3/26 al 15/3/26",
      "contacto": "",
      "inicio": "2026-03-11T03:00:00.000Z",
      "fin": "2026-03-15T03:00:00.000Z"
    },
    {
      "nombre": "Mariangeles Santa Rosa La Pampa (4)",
      "rango": "15/3/26 al 20/3/26",
      "contacto": 2954602596,
      "inicio": "2026-03-15T03:00:00.000Z",
      "fin": "2026-03-20T03:00:00.000Z"
    },
    {
      "nombre": "Sofia (3) Arroyito",
      "rango": "22/3/26 al 29/3/26",
      "contacto": 3576418475,
      "inicio": "2026-03-22T03:00:00.000Z",
      "fin": "2026-03-29T03:00:00.000Z"
    },
    {
      "nombre": "Ariel Botbol (4)",
      "rango": "29/3/26 al 6/4/26",
      "contacto": 1158624199,
      "inicio": "2026-03-29T03:00:00.000Z",
      "fin": "2026-04-06T03:00:00.000Z"
    },
    {
      "nombre": "Luis jubilado (2) Estanzuela",
      "rango": "12/4/26 al 18/4/26",
      "contacto": 3512200765,
      "inicio": "2026-04-12T03:00:00.000Z",
      "fin": "2026-04-18T03:00:00.000Z"
    },
    {
      "nombre": "Rosane dos Passos Conceicao Curvello (3) Booking",
      "rango": "18/4/26 al 21/4/26",
      "contacto": "",
      "inicio": "2026-04-18T03:00:00.000Z",
      "fin": "2026-04-21T03:00:00.000Z"
    }
  ]
}